{
  "$schema": "http://json-schema.org/draft-07/schema#",
  "$id": "https://theoria-dataset.org/schemas/entry.schema.json",
  "title": "THEORIA dataset entry",
  "description": "Schema for a single theoretical‑physics entry in THEORIA.",
  "type": "object",
  "additionalProperties": false,

  "required": [
    "result_id",
    "result_name",
    "result_equations",
    "explanation",
    "definitions",
    "assumptions",
    "depends_on",
    "derivation",
    "programmatic_verification",
    "domain",
    "theory_status",
    "references",
    "contributors",
    "review_status"
  ],

  "properties": {
    "result_id": {
      "type": "string",
      "pattern": "^[a-z0-9_]+$",
      "description": "Unique identifier that must exactly match the filename (without .json extension). Use lowercase letters, numbers, and underscores only. Choose descriptive names that clearly identify the physics concept.",
      "example": "lagrangian_mechanics"
    },

    "result_name": {
      "type": "string",
      "maxLength": 100,
      "description": "Brief title to identify the entry. Keep concise (max 100 characters) and descriptive. Should clearly identify the physics concept."
    },

    "result_equations": {
      "type": "array",
      "minItems": 1,
      "description": "List of physics laws or theorems being derived, in AsciiMath format. Include only the main results that the entry proves - equations that would be the focus of a textbook section. Do NOT include notation definitions (e.g., 'L = L(q, dot(q), t)') or auxiliary equations - those belong in definitions or derivation steps. Provide each equation with a unique ID (e.g., 'eq1', 'eq2'). Use AsciiMath format for all equations.",
      "example": [
        {
          "id": "eq1",
          "equation": "t' = gamma*(t - (v/c^2)*x)"
        }
      ],
      "items": {
        "type": "object",
        "required": ["id", "equation", "equation_title"],
        "additionalProperties": false,
        "properties": {
          "id": {
            "type": "string",
            "description": "Unique short tag for the equation"
          },
          "equation": {
            "type": "string",
            "description": "AsciiMath representation of the equation"
          },
          "equation_title": {
            "type": "string",
            "description": "Human-readable title for this equation (e.g., 'Newton's Second Law', 'Lorentz Transformation', 'Planck's Law'). REQUIRED for all entries. Use this to identify well-known, named equations or laws. At least one derivation step must reference it with equation_proven."
          }
        }
      }
    },

    "explanation": {
      "type": "string",
      "maxLength": 800,
      "description": "Provide a brief (2–5 sentences, max 100 words) conceptual summary of the theoretical result or equation. Assume the reader has a graduate-level understanding of physics. Use clear and concise language to explain the significance, usage, and context of the theoretical result. Content should include: Definition or main concept, Why it matters in physics, How it's used or where it appears. Avoid derivation steps (covered in the derivation section), dense notation or inline math, empty generalities (e.g., \"This is important in physics\"), or overly technical jargon. If, exceptionally, there are math symbols or equations included, they must be enclosed in backticks (``) and written in AsciiMath format.",
      "example": "Lorentz transformations describe how space and time coordinates change between inertial frames moving relative to each other, ensuring the invariance of the speed of light and the spacetime interval. They are foundational to special relativity and crucial for understanding time dilation and length contraction."
    },

    "definitions": {
      "type": "array",
      "minItems": 1,
      "description": "Define every BASE symbol used in result_equations (variables like q, t, m; constants like c, hbar; functions like L, V). Do NOT define intermediate expressions such as partial derivatives, time derivatives, or compound expressions - only define the fundamental symbols themselves. Keep definitions concise (1-2 sentences). Each definition should include a symbol field, with the symbol represented in AsciiMath format and a definition field. If there are math symbols or equations included in the definition, they must be enclosed in backticks (``) and written in AsciiMath format.",
      "example": [
        {
          "symbol": "c",
          "definition": "Speed of light in vacuum."
        }
      ],
      "items": {
        "type": "object",
        "required": ["symbol", "definition"],
        "additionalProperties": false,
        "properties": {
          "symbol": { "type": "string" },
          "definition": { "type": "string" }
        }
      }
    },

    "derivation": {
      "type": "array",
      "minItems": 1,
      "description": "Provide a formal derivation of the result, including all steps, equations in AsciiMath format, and descriptions. Derivation should start from either first principles (listed in the field 'assumptions') or from other results derived in another entry, which should be specified in the 'depends_on' field. Each step should contain the `step` (an integer, in sequential order), `description` (textual rationale), and `equation` (AsciiMath format) fields. Include all steps for complete derivation. Use very explicit detail level for easy following. Mark the step(s) that prove each result equation using the optional `equation_proven` field with the equation ID (e.g., 'eq1'). The derivation should conclude when all result_equations are proven - do NOT add steps after the last equation_proven step. Explanatory content about how to use the result belongs in `explanation` or `historical_context`, not in additional derivation steps.",
      "example": [
        {
          "step": 1,
          "description": "Apply general linear transformation between reference frames.",
          "equation": "x' = A*x + B*t; t' = D*x + E*t"
        },
        {
          "step": 2,
          "description": "For an object at rest in the moving frame, x'=0 always.",
          "equation": "0 = A*v*t + B*t"
        }
      ],
      "items": {
        "type": "object",
        "required": ["step", "description", "equation"],
        "additionalProperties": false,
        "properties": {
          "step": {
            "type": "integer",
            "minimum": 1
          },
          "description": {
            "type": "string",
            "description": "Textual description for this derivation step. Define new symbols that appear. Provide concise and clear rationale, and minimize the formulas, as they should go in the equation field. If there are math symbols or equations included, they must be enclosed in backticks (``) and written in AsciiMath format."
          },
          "equation": { "type": "string" },
          "equation_proven": {
            "type": "string",
            "pattern": "^[a-z0-9_]+$",
            "description": "Optional identifier marking this step as proving a specific equation. The value should reference an equation ID from the result_equations array (e.g., 'eq1', 'eq2'). This indicates that this derivation step proves the corresponding equation from the result_equations, and will be displayed with special visual emphasis in the rendered HTML. For reviewed entries, each equation that has an equation_title MUST have at least one derivation step with equation_proven pointing to that equation's ID."
          },
          "assumptions": {
            "type": "array",
            "description": "Optional references to global assumption IDs from globals/assumptions.json or dependency entry IDs that are specifically applied or invoked in this particular derivation step. Use this to link individual steps to the assumptions or foundational results they rely on, making the logical structure of the derivation more explicit. Use the most specific applicable assumption for each step. If the same broad assumption is used in most steps, consider whether a more specific assumption exists, whether the step actually requires that assumption or just standard algebra, or whether a dependency entry should be used instead.",
            "items": {
              "type": "string",
              "pattern": "^[a-z0-9_]+$"
            }
          }
        }
      }
    },

    "assumptions": {
      "type": "array",
      "description": "Reference global assumptions by ID from the file globals/assumptions.json (e.g., 'classical_mechanics_framework'). First check if a suitable assumption already exists to avoid duplication. Global assumptions are categorized into three types: (1) principle: core theoretical/mathematical postulates (e.g., 'conservation_laws_valid', 'stationary_action_principle'); (2) empirical: experimentally established facts and measured constants (e.g., 'light_speed_constant', 'electromagnetic_polarization'); (3) approximation: validity restrictions and simplifying modeling choices (e.g., 'classical_mechanics_framework', 'point_mass_approximation'). If you need a new global assumption that doesn't exist yet, propose adding it to globals/assumptions.json via pull request before referencing it in your entry. See schemas/assumptions.schema.json for the complete structure and browse the file globals/assumptions.json for all existing assumptions. All assumption IDs MUST exist in globals/assumptions.json - entries will fail validation if they reference non-existent assumptions. If the assumption doesn't exist, either use an existing one, propose adding it via PR first, or create a dependency entry instead if it's a derivable result.",
      "items": {
        "type": "string",
        "pattern": "^[a-z0-9_]+$",
        "description": "Assumption ID from globals/assumptions.json (must match pattern ^[a-z0-9_]+$)"
      }
    },

    "depends_on": {
      "type": "array",
      "description": "Array of entry IDs that this derivation depends on. Each dependency must reference an existing entry result_id. IMPORTANT: Every dependency listed here MUST be referenced in at least one derivation step's 'assumptions' array. Do NOT add redundant parenthetical phrases like '(derived in the dependency entry)' in step descriptions - the dependency is already declared here.",
      "items": {
        "type": "string",
        "pattern": "^[a-z0-9_]+$",
        "description": "Entry result_id that this entry depends on for its derivation"
      }
    },

    "programmatic_verification": {
      "type": "object",
      "description": "Code should verify the mathematical correctness of the `derivation` field by explicitly following the sequence of steps in the derivation. Derivations should be done in `Python`, using `simpy` library. Each step must be annotated with comments. For example: `# Step 2` or `# Steps 4–8`, since programmatic verification may skip or group multiple steps. Use assert statements to ensure correctnesss.",
      "required": ["language", "library", "code"],
      "additionalProperties": false,
      "properties": {
        "language": {
          "type": "string",
          "pattern": "^[A-Za-z]+\\s\\d+\\.\\d+\\.\\d+$",
          "description": "e.g. 'python 3.11.12'"
        },
        "library": {
          "type": "string",
          "pattern": "^(none|[A-Za-z0-9_]+\\s\\d+\\.\\d+\\.\\d+)$",
          "description": "e.g. 'sympy 1.13.0' or 'none' for standard library only"
        },
        "code": {
          "type": "array",
          "minItems": 1,
          "items": {
            "type": "string"
          }
        }
      }
    },

    "domain": {
      "type": "string",
      "description": "ArXiv category identifier (e.g., 'gr-qc', 'hep-th') from https://arxiv.org/category_taxonomy. Use official arXiv taxonomy identifiers.",
      "pattern": "^[a-z][a-z\\-\\.]+$"
    },

    "theory_status": {
      "type": "string",
      "enum": [
        "current",
        "historical",
        "approximation",
        "limiting_case",
        "generalized"
      ],
      "description": "Current scientific status of the theory. current: Modern theories widely accepted by scientific community. historical: Important for development but generalized by more comprehensive theories. approximation: Valid simplifications of more general theories. limiting_case: Special cases with restricted applicability. generalized: Subsumed into a more general framework but remains valid in its regime."
    },

    "generalized_by": {
      "type": "array",
      "description": "Theories that generalize or supersede this result. Use exact result_id values (without .json extension). Must reference existing entries in the dataset.",
      "items": {
        "type": "string",
        "pattern": "^[a-z0-9_]+$"
      }
    },

    "historical_context": {
      "type": "object",
      "description": "Educational context about theory's development. Provide importance, development period, and key insights.",
      "additionalProperties": false,
      "properties": {
        "importance": {
          "type": "string"
        },
        "development_period": {
          "type": "string"
        },
        "key_insights": {
          "type": "array",
          "items": {
            "type": "string"
          }
        }
      }
    },

    "references": {
      "type": "array",
      "minItems": 1,
      "maxItems": 3,
      "description": "Academic citations (1-3 references in APA style). Use APA format: Author(s). (Year). Title. Publisher/Journal, volume(issue), pages. DOI/URL. For historical results, include at least one seminal/original reference when available - modern textbook references are valuable but should not replace the original source.",
      "example": [
        {
          "id": "R1",
          "citation": "Einstein, A. (1905). 'On the Electrodynamics of Moving Bodies.' *Annalen der Physik*, 17, 891–921."
        }
      ],
      "items": {
        "type": "object",
        "required": ["id", "citation"],
        "additionalProperties": false,
        "properties": {
          "id": { "type": "string" },
          "citation": { "type": "string" }
        }
      }
    },

    "contributors": {
      "type": "array",
      "minItems": 1,
      "description": "List of contributors who created or modified this entry. Each contributor must have a full name and an identifier (ORCID, website, LinkedIn, etc.).",
      "items": {
        "type": "object",
        "required": ["full_name", "identifier"],
        "additionalProperties": false,
        "properties": {
          "full_name": {
            "type": "string",
            "description": "Full name of the contributor"
          },
          "identifier": {
            "type": "string",
            "description": "Unique identifier for the contributor (ORCID, personal website, academic profile, LinkedIn, etc.)"
          }
        }
      }
    },

    "review_status": {
      "type": "string",
      "enum": ["draft", "reviewed"],
      "description": "Review status of the entry. Use 'draft' for initial submissions. Use 'reviewed' for entries approved for main dataset."
    }
  }
}
