{
  "result_id": "vis_viva",
  "result_name": "Vis-Viva Equation",
  "result_equations": [
    {
      "id": "vis_viva_equation",
      "equation": "v^2=GM(2/r-1/a)",
      "equation_title": "Vis-Viva Equation"
    }
  ],
  "explanation": "The Vis-Viva equation relates the velocity of a particle in an elliptical, hyperbolic or parabolic orbit to the distance to the barycenter, mass of the body it's orbiting, and the semi-major axis of the orbit. This sets the basis for velocity calculations in non-circular orbits and allows us to later derive equations like the equation for escape velocity with ease.",
  "definitions": [
    {
      "symbol": "v",
      "definition": "Orbital velocity of the particle"
    },
    {
      "symbol": "G",
      "definition": "Newton's Gravitational Constant"
    },
    {
      "symbol": "M",
      "definition": "Mass of the body being orbited"
    },
    {
      "symbol": "r",
      "definition": "Distance from the center of mass of the orbiting body to the barycenter of the system"
    },
    {
      "symbol": "a",
      "definition": "The semi-major axis of the orbit"
    }
  ],
  "assumptions": [
    "point_mass_approximation",
    "conservation_laws_valid",
    "system_isolation",
    "newtons_law_gravitation"
  ],
  "depends_on": [
    "angular_momentum"
  ],
  "derivation": [
    {
      "step": 1,
      "assumptions": [
        "newtons_law_gravitation"
      ],
      "description": "Apply conservation of energy to equate the energies at the apoapsis and periapsis using gravitational potential energy",
      "equation": "1/2 mv_a^2 - (GMm)/r_a = 1/2mv_p^2-(GMm)/r_p"
    },
    {
      "step": 2,
      "assumptions": [
        "point_mass_approximation"
      ],
      "description": "Rearrange and simplify, treating bodies as point masses with spherically symmetric mass distributions",
      "equation": "v_a^2/2 - v_p^2/2 = (GM)/r_a - (GM)/r_p"
    },
    {
      "step": 3,
      "assumptions": [
        "angular_momentum"
      ],
      "description": "Use conservation of angular momentum to obtain an expression for `v_p` in terms of `r_a`, `r_p` and `v_a`",
      "equation": "L=const=v_ar_a=v_pr_p => v_p = (r_av_a)/r_p"
    },
    {
      "step": 4,
      "assumptions": [
        "conservation_laws_valid"
      ],
      "description": "Substitute the angular momentum expression into the energy equation from step 2, using conservation laws",
      "equation": "1/2(1-(r_a/r_p)^2)v_a^2 = (GM)/r_a - (GM)/r_p"
    },
    {
      "step": 5,
      "description": "Isolate `v_a^2/2` (KE at apoapsis)",
      "equation": "v_a^2/2 = (GM(1/r_a - 1/r_p))/(1 - (r_a/r_p)^2) = ((GM(r_p - r_a))/(r_a r_p)) / ((r_p^2 - r_a^2)/r_p^2) = GM r_p/(r_a(r_p + r_a))"
    },
    {
      "step": 6,
      "description": "Use the identity `r_a+r_p=2a` to simplify the expression",
      "equation": "v_a^2/2 = GM(2a-r_a)/(r_a(2a)) = (GM)/r_a-(GM)/(2a)"
    },
    {
      "step": 7,
      "assumptions": [
        "system_isolation"
      ],
      "description": "Equate the total energy at any point in the orbit where the particle's velocity is v with the velocity at the apoapsis, assuming the system is isolated from external perturbations",
      "equation": "v^2/2 - (GM)/r = v_a^2/2 - (GM)/r_a = -(GM)/(2a)"
    },
    {
      "step": 8,
      "equation_proven": "vis_viva_equation",
      "description": "Rearrange the expression `v^2/2 - GM/r = -(GM)/(2a)`",
      "equation": "v^2 = GM(2/r-1/a)"
    }
  ],
  "programmatic_verification": {
    "language": "python 3.11.12",
    "library": "sympy 1.13.1",
    "code": [
      "import sympy as sp",
      "",
      "# Step 1: Define specific energies at apoapsis and periapsis",
      "G, M, a, r, v = sp.symbols('G M a r v', positive=True)",
      "v_a, v_p, r_a, r_p = sp.symbols('v_a v_p r_a r_p', positive=True)",
      "E_a = sp.Rational(1, 2) * v_a**2 - (G*M)/r_a",
      "E_p = sp.Rational(1, 2) * v_p**2 - (G*M)/r_p",
      "eq_energy = sp.Eq(E_a, E_p)",
      "",
      "# Step 2: Rearranged energy equation",
      "step2_expected = sp.Eq(sp.Rational(1, 2) * (v_a**2 - v_p**2), G*M*(1/r_a - 1/r_p))",
      "assert sp.simplify(eq_energy.lhs - eq_energy.rhs - (step2_expected.lhs - step2_expected.rhs)) == 0",
      "",
      "# Step 3: Angular momentum conservation gives v_p in terms of v_a, r_a, r_p",
      "eq_angmom = sp.Eq(v_a*r_a, v_p*r_p)",
      "v_p_from_L = sp.solve(eq_angmom, v_p)[0]",
      "assert sp.simplify(v_p_from_L - (r_a*v_a)/r_p) == 0",
      "",
      "# Step 4: Substitute step-3 expression into step-2 equation",
      "eq_step4 = sp.simplify(step2_expected.subs(v_p, v_p_from_L))",
      "step4_expected = sp.Eq(sp.Rational(1, 2) * (1 - (r_a/r_p)**2) * v_a**2, G*M*(1/r_a - 1/r_p))",
      "assert sp.simplify((eq_step4.lhs - eq_step4.rhs) + (step4_expected.lhs - step4_expected.rhs)) == 0",
      "",
      "# Step 5: Solve for v_a^2/2",
      "va2_over_2 = sp.simplify(sp.solve(eq_step4, v_a**2)[0] / 2)",
      "step5_expected = sp.simplify(G*M * r_p / (r_a * (r_p + r_a)))",
      "assert sp.simplify(va2_over_2 - step5_expected) == 0",
      "",
      "# Step 6: Use r_p + r_a = 2a",
      "va2_over_2_step6 = sp.simplify(va2_over_2.subs(r_p, 2*a - r_a))",
      "step6_expected = sp.simplify(G*M/r_a - G*M/(2*a))",
      "assert sp.simplify(va2_over_2_step6 - step6_expected) == 0",
      "",
      "# Step 7: Orbital specific energy constant equals -GM/(2a)",
      "E_constant = sp.simplify(E_a.subs(v_a**2, 2*va2_over_2_step6))",
      "assert sp.simplify(E_constant + G*M/(2*a)) == 0",
      "",
      "# Step 8: Recover vis-viva relation at arbitrary r",
      "E_general = sp.Rational(1, 2) * v**2 - (G*M)/r",
      "v2_expr = sp.simplify(sp.solve(sp.Eq(E_general, E_constant), v**2)[0])",
      "vis_viva_expected = G*M*(2/r - 1/a)",
      "assert sp.simplify(v2_expr - vis_viva_expected) == 0",
      "",
      "print('Vis-viva programmatic verification passed')"
    ]
  },
  "domain": "astro-ph",
  "theory_status": "current",
  "historical_context": {
    "importance": "Heavily used in astrophysics and astrodynamics to calculate the velocities of orbiting objects. From this equation one can easily derive other equations such as the formula for escape velocity.",
    "development_period": "1676–1689",
    "key_insights": [
      "Orbital velocities",
      "Conservation of energy in orbits"
    ]
  },
  "references": [
    {
      "id": "R1",
      "citation": "Logsdon, Thomas S.; Logsdon, Tom (1998). Orbital mechanics: theory and applications."
    }
  ],
  "contributors": [
    {
      "full_name": "@Astrophysics108",
      "identifier": "https://astrophysics108.github.io/delana"
    }
  ],
  "review_status": "reviewed"
}
